{
  "contractVersion": 2,
  "taskId": "API-002",
  "phase": "implementation",
  "workArea": "api-and-domain",
  "title": "Establish KEYFORTA API runtime and public property discovery",
  "businessObjectiveReference": "https://github.com/keyforta/keyforta-property/issues/1",
  "issueReference": "https://github.com/keyforta/keyforta-property/issues/1",
  "requirementReferences": [
    "https://github.com/keyforta/keyforta-property/issues/1",
    "docs/keyforta-backend-implementation-specification.md",
    "docs/backend-integration-contract.md",
    "docs/openapi.yaml"
  ],
  "classification": "dependency",
  "workflowState": "implemented",
  "stateHistory": [
    {
      "state": "proposed",
      "actor": "Product owner",
      "enteredAt": "2026-09-15T17:54:27.000Z",
      "evidenceReferences": [
        "https://github.com/keyforta/keyforta-property/issues/1"
      ]
    },
    {
      "state": "analyzed",
      "actor": "Product and Requirements Analyst",
      "enteredAt": "2026-09-15T17:54:27.000Z",
      "evidenceReferences": [
        "docs/engineering/evidence/API-002.md"
      ]
    },
    {
      "state": "approved",
      "actor": "Product owner",
      "enteredAt": "2026-09-15T17:54:27.000Z",
      "evidenceReferences": [
        "https://github.com/keyforta/keyforta-property/issues/1"
      ],
      "approval": {
        "approver": "cmbuyamba",
        "role": "product-owner",
        "decision": "approved",
        "evidenceReference": "https://github.com/keyforta/keyforta-property/issues/1",
        "commitSha": "ed6a8ca2c104d6b48c4df6d993facb6c34ef42c5"
      }
    },
    {
      "state": "designed",
      "actor": "Solution Architect",
      "enteredAt": "2026-09-15T17:54:27.000Z",
      "evidenceReferences": [
        "docs/engineering/evidence/API-002.md",
        "docs/adr/ADR-001-modular-monolith.md",
        "docs/adr/ADR-002-organization-isolation.md"
      ]
    },
    {
      "state": "implementation-ready",
      "actor": "Backend Engineer",
      "enteredAt": "2026-09-15T17:54:27.000Z",
      "evidenceReferences": [
        "docs/engineering/evidence/API-002.md"
      ]
    },
    {
      "state": "implemented",
      "actor": "Backend Engineer",
      "enteredAt": "2026-09-15T18:13:30.000Z",
      "evidenceReferences": [
        "apps/api/src/app.ts",
        "apps/api/test/app.test.ts",
        "docs/engineering/evidence/API-002.md"
      ]
    }
  ],
  "assignedAgent": "Backend Engineer",
  "routingRuleId": "ROUTE-005",
  "supportingReviewers": [
    "Security and Privacy Reviewer",
    "QA and Test Engineer",
    "Pull Request Reviewer"
  ],
  "dependencies": [
    "KEYFORTA merge baseline ed6a8ca2c104d6b48c4df6d993facb6c34ef42c5",
    "Source revision 39eab863e83d684c113f16f33e0a3b92f9ee8188"
  ],
  "allowedPaths": [
    "apps/api/",
    "packages/contracts/",
    "docs/adr/ADR-011-public-property-discovery-route.md",
    "docs/engineering/evidence/API-002.md",
    "docs/openapi.yaml",
    "harness/tasks/API-002.json",
    "pnpm-lock.yaml"
  ],
  "declaredProtectedPaths": [
    "apps/api/"
  ],
  "protectedPaths": [
    "AGENTS.md",
    ".github/",
    "docs/product/",
    "docs/architecture/adr/",
    "harness/policies/",
    "harness/schemas/",
    "infra/",
    "packages/auth/",
    "packages/authorization/"
  ],
  "acceptanceCriteriaReferences": [
    "https://github.com/keyforta/keyforta-property/issues/1",
    "docs/engineering/evidence/API-002.md"
  ],
  "acceptanceCriteria": [
    {
      "id": "AC-API-002-01",
      "requirementReferences": [
        "docs/keyforta-backend-implementation-specification.md"
      ],
      "testReferences": [
        "apps/api/test/app.test.ts"
      ]
    },
    {
      "id": "AC-API-002-02",
      "requirementReferences": [
        "docs/openapi.yaml"
      ],
      "testReferences": [
        "apps/api/test/app.test.ts"
      ]
    },
    {
      "id": "AC-API-002-03",
      "requirementReferences": [
        "docs/backend-integration-contract.md"
      ],
      "testReferences": [
        "apps/api/test/app.test.ts"
      ]
    },
    {
      "id": "AC-API-002-04",
      "requirementReferences": [
        "AGENTS.md"
      ],
      "testReferences": [
        "apps/api/test/identity.test.ts"
      ]
    }
  ],
  "technicalDecisionReferences": [
    "docs/adr/ADR-011-public-property-discovery-route.md",
    "docs/engineering/evidence/API-002.md",
    "docs/adr/ADR-001-modular-monolith.md",
    "docs/adr/ADR-002-organization-isolation.md"
  ],
  "requiredScenarios": [
    "canonical-verification"
  ],
  "requiredCommands": [
    "pnpm check",
    "node harness/graders/architecture.mjs",
    "pnpm build",
    "pnpm verify:all"
  ],
  "requiredEvidence": [
    "docs/engineering/evidence/API-002.md",
    "harness/reports/verify-latest.json",
    "harness/reports/evidence-API-002.json"
  ],
  "riskClassification": "high",
  "securityImpact": "Introduces an externally reachable Fastify boundary. This slice is anonymous read-only and must expose only published public-safe property data while returning sanitized errors and correlation IDs.",
  "dataImpact": "No schema or migration changes. A dependency-injected read gateway provides property data; production persistence remains outside this slice.",
  "observabilityImpact": "Adds health and readiness endpoints, request correlation IDs, and structured server logging without adding external telemetry services.",
  "rollbackConsiderations": "Revert the API-002 commit. Existing static web behavior remains the fallback and no deployment workflow is activated.",
  "humanApprovalRequirements": [
    "Product, Architecture, Security, and Data scope approval recorded in issue #1",
    "Independent security, QA, and pull-request review before merge",
    "No production deployment or frontend activation in this task"
  ],
  "repairCycle": 0
}