{
  "contractVersion": 2,
  "taskId": "HAR-005",
  "phase": "implementation",
  "workArea": "governance-and-harness",
  "title": "Repair isolated CI tool access and cleanup",
  "businessObjectiveReference": "https://github.com/keyforta/keyforta-property/issues/14",
  "issueReference": "https://github.com/keyforta/keyforta-property/issues/14",
  "requirementReferences": [
    "https://github.com/keyforta/keyforta-property/issues/14",
    "docs/engineering/EVIDENCE_DRIVEN_DEVELOPMENT.md"
  ],
  "classification": "bugfix",
  "workflowState": "implemented",
  "stateHistory": [
    {
      "state": "proposed",
      "actor": "Product owner",
      "enteredAt": "2026-09-15T20:38:37.000Z",
      "evidenceReferences": [
        "https://github.com/keyforta/keyforta-property/issues/14"
      ]
    },
    {
      "state": "analyzed",
      "actor": "Product and Requirements Analyst",
      "enteredAt": "2026-09-15T20:38:37.000Z",
      "evidenceReferences": [
        "docs/engineering/evidence/HAR-005.md"
      ]
    },
    {
      "state": "approved",
      "actor": "Product owner",
      "enteredAt": "2026-09-15T20:38:37.000Z",
      "evidenceReferences": [
        "https://github.com/keyforta/keyforta-property/issues/14"
      ],
      "approval": {
        "approver": "cmbuyamba",
        "role": "product-owner",
        "decision": "approved",
        "evidenceReference": "https://github.com/keyforta/keyforta-property/issues/14",
        "commitSha": "0b15e391fada4249cf464e06c279b36b2922dc27"
      }
    },
    {
      "state": "designed",
      "actor": "Solution Architect",
      "enteredAt": "2026-09-15T20:38:37.000Z",
      "evidenceReferences": [
        "docs/engineering/evidence/HAR-005.md"
      ]
    },
    {
      "state": "implementation-ready",
      "actor": "Harness and Evaluation Engineer",
      "enteredAt": "2026-09-15T20:38:37.000Z",
      "evidenceReferences": [
        "docs/engineering/evidence/HAR-005.md"
      ]
    },
    {
      "state": "implemented",
      "actor": "Harness and Evaluation Engineer",
      "enteredAt": "2026-09-15T20:38:38.000Z",
      "evidenceReferences": [
        ".github/workflows/ci.yml",
        "harness/scripts/self-test/20-evidence-lifecycle.suite.mjs",
        "docs/engineering/evidence/HAR-005.md"
      ]
    },
    {
      "state": "changes-requested",
      "actor": "Harness and Evaluation Engineer",
      "enteredAt": "2026-09-15T20:41:45.000Z",
      "evidenceReferences": [
        "docs/engineering/evidence/HAR-005.md"
      ]
    },
    {
      "state": "implemented",
      "actor": "Harness and Evaluation Engineer",
      "enteredAt": "2026-09-15T20:41:46.000Z",
      "evidenceReferences": [
        "harness/tasks/HAR-005.json",
        "docs/engineering/evidence/HAR-005.md"
      ]
    },
    {
      "state": "changes-requested",
      "actor": "GitHub CI",
      "enteredAt": "2026-09-15T20:50:24.000Z",
      "evidenceReferences": [
        "https://github.com/keyforta/keyforta-property/actions/runs/35021918040"
      ]
    },
    {
      "state": "implemented",
      "actor": "Harness and Evaluation Engineer",
      "enteredAt": "2026-09-15T20:50:25.000Z",
      "evidenceReferences": [
        ".github/workflows/ci.yml",
        "harness/scripts/self-test/20-evidence-lifecycle.suite.mjs",
        "docs/engineering/evidence/HAR-005.md"
      ]
    },
    {
      "state": "changes-requested",
      "actor": "Pull Request Reviewer",
      "enteredAt": "2026-09-15T20:54:05.000Z",
      "evidenceReferences": [
        "docs/engineering/evidence/HAR-005.md"
      ]
    },
    {
      "state": "implemented",
      "actor": "Harness and Evaluation Engineer",
      "enteredAt": "2026-09-15T20:54:06.000Z",
      "evidenceReferences": [
        "harness/scripts/self-test/20-evidence-lifecycle.suite.mjs",
        "docs/engineering/evidence/HAR-005.md"
      ]
    }
  ],
  "assignedAgent": "Harness and Evaluation Engineer",
  "routingRuleId": "ROUTE-008",
  "supportingReviewers": [
    "Solution Architect",
    "Security and Privacy Reviewer",
    "Pull Request Reviewer"
  ],
  "dependencies": [
    "HAR-003 exact head 0b15e391fada4249cf464e06c279b36b2922dc27",
    "HAR-003 remains at its governed three-cycle limit"
  ],
  "allowedPaths": [
    ".gitignore",
    ".github/workflows/ci.yml",
    "docs/engineering/evidence/HAR-003.md",
    "docs/engineering/evidence/HAR-005.md",
    "harness/scripts/report-retention-guard.mjs",
    "harness/scripts/secret-scan.mjs",
    "harness/scripts/self-test/20-evidence-lifecycle.suite.mjs",
    "harness/scripts/verify-reports.mjs",
    "harness/tasks/HAR-003.json",
    "harness/tasks/HAR-005.json"
  ],
  "declaredProtectedPaths": [
    ".github/workflows/ci.yml"
  ],
  "protectedPaths": [
    "AGENTS.md",
    ".github/",
    "docs/product/",
    "docs/architecture/adr/",
    "harness/policies/",
    "harness/schemas/",
    "infra/",
    "packages/auth/",
    "packages/authorization/"
  ],
  "acceptanceCriteriaReferences": [
    "https://github.com/keyforta/keyforta-property/issues/14",
    "docs/engineering/evidence/HAR-005.md"
  ],
  "acceptanceCriteria": [
    {
      "id": "AC-HAR-005-01",
      "requirementReferences": [
        "https://github.com/keyforta/keyforta-property/issues/14"
      ],
      "testReferences": [
        "harness/scripts/self-test/20-evidence-lifecycle.suite.mjs"
      ]
    },
    {
      "id": "AC-HAR-005-02",
      "requirementReferences": [
        "docs/engineering/EVIDENCE_DRIVEN_DEVELOPMENT.md"
      ],
      "testReferences": [
        "harness/scripts/self-test/20-evidence-lifecycle.suite.mjs"
      ]
    }
  ],
  "technicalDecisionReferences": [
    "docs/engineering/EVIDENCE_DRIVEN_DEVELOPMENT.md",
    "docs/engineering/evidence/HAR-005.md"
  ],
  "requiredScenarios": [
    "canonical-verification"
  ],
  "requiredCommands": [
    "pnpm harness:self-test",
    "pnpm verify:all"
  ],
  "requiredEvidence": [
    "docs/engineering/evidence/HAR-005.md",
    "harness/reports/verify-latest.json",
    "harness/reports/evidence-HAR-005.json"
  ],
  "riskClassification": "high",
  "securityImpact": "Restores isolated validation without granting the producer access to runner-home credentials or write access to the pnpm installation, and permits runner-owned frozen-control cleanup.",
  "dataImpact": "No product, personal, persistent, or production data changes.",
  "observabilityImpact": "GitHub CI can reach canonical verification and still retains only scanned evidence snapshots.",
  "rollbackConsiderations": "Reverting HAR-005 restores the observed permission failures and prevents PR validation from completing.",
  "humanApprovalRequirements": [
    "Product-owner bugfix scope and protected-workflow approval recorded in issue #14 and the approving Copilot session",
    "Independent architecture, security, and pull-request review before merge",
    "GitHub CI and protected-branch controls remain authoritative",
    "No harness policy, schema, product-runtime, data, infrastructure, or deployment changes"
  ],
  "repairCycle": 3
}