{
  "contractVersion": 2,
  "taskId": "HAR-012",
  "phase": "implementation",
  "workArea": "governance-and-harness",
  "title": "Complete PR 13 CI validation",
  "businessObjectiveReference": "https://github.com/keyforta/keyforta-property/pull/13",
  "issueReference": "https://github.com/keyforta/keyforta-property/issues/23",
  "requirementReferences": [
    "https://github.com/keyforta/keyforta-property/issues/23",
    "docs/engineering/EVIDENCE_DRIVEN_DEVELOPMENT.md"
  ],
  "classification": "bugfix",
  "workflowState": "implemented",
  "stateHistory": [
    {
      "state": "proposed",
      "actor": "Product owner",
      "enteredAt": "2026-09-16T01:30:16.000Z",
      "evidenceReferences": ["https://github.com/keyforta/keyforta-property/pull/13"]
    },
    {
      "state": "analyzed",
      "actor": "Harness and Evaluation Engineer",
      "enteredAt": "2026-09-16T01:30:16.000Z",
      "evidenceReferences": ["docs/engineering/evidence/HAR-012.md"]
    },
    {
      "state": "approved",
      "actor": "Product owner",
      "enteredAt": "2026-09-16T01:30:16.000Z",
      "evidenceReferences": ["https://github.com/keyforta/keyforta-property/pull/13"],
      "approval": {
        "approver": "cmbuyamba",
        "role": "product-owner",
        "decision": "approved",
        "evidenceReference": "https://github.com/keyforta/keyforta-property/pull/13",
        "commitSha": "57767fbf2ace0da6da1ad3895da97ebf4cb66108"
      }
    },
    {
      "state": "designed",
      "actor": "Harness and Evaluation Engineer",
      "enteredAt": "2026-09-16T01:30:16.000Z",
      "evidenceReferences": ["docs/engineering/evidence/HAR-012.md"]
    },
    {
      "state": "implementation-ready",
      "actor": "Harness and Evaluation Engineer",
      "enteredAt": "2026-09-16T01:30:16.000Z",
      "evidenceReferences": ["docs/engineering/evidence/HAR-012.md"]
    },
    {
      "state": "implemented",
      "actor": "Harness and Evaluation Engineer",
      "enteredAt": "2026-09-16T01:31:56.000Z",
      "evidenceReferences": [
        "harness/scripts/self-test/20-evidence-lifecycle.suite.mjs",
        "docs/engineering/evidence/HAR-012.md"
      ]
    },
    {
      "state": "changes-requested",
      "actor": "Harness and Evaluation Engineer",
      "enteredAt": "2026-09-16T01:35:11.000Z",
      "evidenceReferences": ["harness/reports/verify-latest.json"]
    },
    {
      "state": "implemented",
      "actor": "Harness and Evaluation Engineer",
      "enteredAt": "2026-09-16T01:35:11.000Z",
      "evidenceReferences": ["docs/engineering/evidence/HAR-012.md"]
    },
    {
      "state": "changes-requested",
      "actor": "Security and Privacy Reviewer",
      "enteredAt": "2026-09-16T01:40:28.000Z",
      "evidenceReferences": ["docs/engineering/evidence/HAR-012.md"]
    },
    {
      "state": "implemented",
      "actor": "Harness and Evaluation Engineer",
      "enteredAt": "2026-09-16T01:40:28.000Z",
      "evidenceReferences": [
        "harness/scripts/self-test/20-evidence-lifecycle.suite.mjs",
        "docs/engineering/evidence/HAR-012.md"
      ]
    },
    {
      "state": "changes-requested",
      "actor": "Security and Privacy Reviewer",
      "enteredAt": "2026-09-16T01:46:38.000Z",
      "evidenceReferences": ["docs/engineering/evidence/HAR-012.md"]
    },
    {
      "state": "implemented",
      "actor": "Harness and Evaluation Engineer",
      "enteredAt": "2026-09-16T01:46:38.000Z",
      "evidenceReferences": [
        "harness/scripts/self-test/20-evidence-lifecycle.suite.mjs",
        "docs/engineering/evidence/HAR-012.md"
      ]
    }
  ],
  "assignedAgent": "Harness and Evaluation Engineer",
  "routingRuleId": "ROUTE-008",
  "supportingReviewers": [
    "Security and Privacy Reviewer",
    "Solution Architect",
    "Pull Request Reviewer"
  ],
  "dependencies": [
    "HAR-011 remains blocked at repair cycle 3",
    "GitHub CI failure https://github.com/keyforta/keyforta-property/actions/runs/35042167238"
  ],
  "allowedPaths": [
    ".github/workflows/ci.yml",
    "docs/engineering/evidence/HAR-003.md",
    "docs/engineering/evidence/HAR-005.md",
    "docs/engineering/evidence/HAR-006.md",
    "docs/engineering/evidence/HAR-009.md",
    "docs/engineering/evidence/HAR-010.md",
    "docs/engineering/evidence/HAR-011.md",
    "docs/engineering/evidence/HAR-012.md",
    "harness/scripts/edd-lib.mjs",
    "harness/scripts/self-test/20-evidence-lifecycle.suite.mjs",
    "harness/tasks/HAR-003.json",
    "harness/tasks/HAR-005.json",
    "harness/tasks/HAR-006.json",
    "harness/tasks/HAR-009.json",
    "harness/tasks/HAR-010.json",
    "harness/tasks/HAR-011.json",
    "harness/tasks/HAR-012.json"
  ],
  "declaredProtectedPaths": [".github/workflows/ci.yml"],
  "protectedPaths": [
    "AGENTS.md",
    ".github/",
    "docs/product/",
    "docs/architecture/adr/",
    "harness/policies/",
    "harness/schemas/",
    "infra/",
    "packages/auth/",
    "packages/authorization/"
  ],
  "acceptanceCriteriaReferences": [
    "https://github.com/keyforta/keyforta-property/pull/13",
    "docs/engineering/evidence/HAR-012.md"
  ],
  "acceptanceCriteria": [
    {
      "id": "AC-HAR-012-01",
      "requirementReferences": ["https://github.com/keyforta/keyforta-property/pull/13"],
      "testReferences": ["harness/scripts/self-test/20-evidence-lifecycle.suite.mjs"]
    },
    {
      "id": "AC-HAR-012-02",
      "requirementReferences": ["https://github.com/keyforta/keyforta-property/issues/23"],
      "testReferences": ["harness/scripts/self-test/20-evidence-lifecycle.suite.mjs"]
    },
    {
      "id": "AC-HAR-012-03",
      "requirementReferences": ["docs/engineering/EVIDENCE_DRIVEN_DEVELOPMENT.md"],
      "testReferences": ["harness/scripts/self-test/20-evidence-lifecycle.suite.mjs"],
      "manualVerification": "PR 13 exact-head CI and protected retention pass."
    }
  ],
  "technicalDecisionReferences": [
    "docs/engineering/EVIDENCE_DRIVEN_DEVELOPMENT.md",
    "docs/engineering/evidence/HAR-012.md"
  ],
  "requiredScenarios": ["canonical-verification"],
  "requiredCommands": ["pnpm harness:self-test", "pnpm verify:all"],
  "requiredEvidence": [
    "docs/engineering/evidence/HAR-012.md",
    "harness/reports/verify-latest.json",
    "harness/reports/evidence-HAR-012.json"
  ],
  "riskClassification": "critical",
  "securityImpact": "Prevents nested sudo in the unprivileged CI self-test while preserving direct observation of the actual launcher boundary.",
  "dataImpact": "No product or production data changes.",
  "observabilityImpact": "CI reports the live launcher environment regression without requiring producer sudo access.",
  "rollbackConsiderations": "Revert HAR-012 and leave PR 13 in draft if exact-head CI fails.",
  "humanApprovalRequirements": [
    "Product-owner direction recorded in the governing Copilot session",
    "Exact-head GitHub CI and protected retention must pass",
    "Human merge approval"
  ],
  "repairCycle": 3
}